film_id,Title,Description,ReleaseYear,Language,RentalDuration,RentalRate,Rating,Length,ReplacementCost,SpecialFeatures,Category,Actors
87,"BOONDOCK BALLROOM","A Fateful Panorama of a Crocodile And a Boy who must Defeat a Monkey in The Gulf of Mexico",2006,English,7,0.99,NC-17,76,14.99,"Behind the Scenes",Travel,"3//ED//CHASE,4//JENNIFER//DAVIS,13//UMA//WOOD,16//FRED//COSTNER,21//KIRSTEN//PALTROW,30//SANDRA//PECK,56//DAN//HARRIS,64//RAY//JOHANSSON,88//KENNETH//PESCI,98//CHRIS//BRIDGES,119//WARREN//JACKMAN,184//HUMPHREY//GARLAND,190//AUDREY//BAILEY"
88,"BORN SPINAL","A Touching Epistle of a Frisbee And a Husband who must Pursue a Student in Nigeria",2006,English,7,4.99,PG,179,17.99,"Trailers,Commentaries,Deleted Scenes",Travel,"21//KIRSTEN//PALTROW,31//SISSY//SOBIESKI,44//NICK//STALLONE,59//DUSTIN//TAUTOU,64//RAY//JOHANSSON,69//KENNETH//PALTROW,116//DAN//STREEP,135//RITA//REYNOLDS,194//MERYL//ALLEN"
89,"BORROWERS BEDAZZLED","A Brilliant Epistle of a Teacher And a Sumo Wrestler who must Defeat a Man in An Abandoned Fun House",2006,English,7,0.99,G,63,22.99,"Commentaries,Deleted Scenes,Behind the Scenes",Animation,"15//CUBA//OLIVIER,22//ELVIS//MARX,43//KIRK//JOVOVICH,81//SCARLETT//DAMON,129//DARYL//CRAWFORD,161//HARVEY//HOPE,176//JON//CHASE"
90,"BOULEVARD MOB","A Fateful Epistle of a Moose And a Monkey who must Confront a Lumberjack in Ancient China",2006,English,3,0.99,R,63,11.99,Trailers,New,"26//RIP//CRAWFORD,34//AUDREY//OLIVIER,92//KIRSTEN//AKROYD,114//MORGAN//MCDORMAND,116//DAN//STREEP,139//EWAN//GOODING,144//ANGELA//WITHERSPOON,161//HARVEY//HOPE"
91,"BOUND CHEAPER","A Thrilling Panorama of a Database Administrator And a Astronaut who must Challenge a Lumberjack in A Baloon",2006,English,5,0.99,PG,98,17.99,"Behind the Scenes",Classics,"12//KARL//BERRY,15//CUBA//OLIVIER"
92,"BOWFINGER GABLES","A Fast-Paced Yarn of a Waitress And a Composer who must Outgun a Dentist in California",2006,English,7,4.99,NC-17,72,19.99,"Trailers,Deleted Scenes",Horror,"12//KARL//BERRY,52//CARMEN//HUNT,70//MICHELLE//MCCONAUGHEY,85//MINNIE//ZELLWEGER,168//WILL//WILSON"
93,"BRANNIGAN SUNRISE","A Amazing Epistle of a Moose And a Crocodile who must Outrace a Dog in Berlin",2006,English,4,4.99,PG,121,27.99,Trailers,New,"26//RIP//CRAWFORD,169//KENNETH//HOFFMAN"
94,"BRAVEHEART HUMAN","A Insightful Story of a Dog And a Pastry Chef who must Battle a Girl in Berlin",2006,English,7,2.99,PG-13,176,14.99,"Trailers,Deleted Scenes",Family,"44//NICK//STALLONE,92//KIRSTEN//AKROYD,131//JANE//JACKMAN,150//JAYNE//NOLTE"
95,"BREAKFAST GOLDFINGER","A Beautiful Reflection of a Student And a Student who must Fight a Moose in Berlin",2006,English,5,4.99,G,123,18.99,"Trailers,Commentaries,Deleted Scenes",New,"76//ANGELINA//ASTAIRE,149//RUSSELL//TEMPLE,165//AL//GARLAND,185//MICHAEL//BOLGER,186//JULIA//ZELLWEGER"
96,"BREAKING HOME","A Beautiful Display of a Secret Agent And a Monkey who must Battle a Sumo Wrestler in An Abandoned Mine Shaft",2006,English,4,2.99,PG-13,169,21.99,"Trailers,Commentaries",New,"7//GRACE//MOSTEL,17//HELEN//VOIGHT,28//WOODY//HOFFMAN,52//CARMEN//HUNT,126//FRANCES//TOMEI,137//MORGAN//WILLIAMS"
97,"BRIDE INTRIGUE","A Epic Tale of a Robot And a Monkey who must Vanquish a Man in New Orleans",2006,English,7,0.99,G,56,24.99,"Trailers,Commentaries,Behind the Scenes",Action,65//ANGELA//HUDSON
98,"BRIGHT ENCOUNTERS","A Fateful Yarn of a Lumberjack And a Feminist who must Conquer a Student in A Jet Boat",2006,English,4,4.99,PG-13,73,12.99,Trailers,Drama,"111//CAMERON//ZELLWEGER,125//ALBERT//NOLTE,187//RENEE//BALL,194//MERYL//ALLEN"
99,"BRINGING HYSTERICAL","A Fateful Saga of a A Shark And a Technical Writer who must Find a Woman in A Jet Boat",2006,English,7,2.99,PG,136,14.99,Trailers,Comedy,"48//FRANCES//DAY-LEWIS,144//ANGELA//WITHERSPOON"
100,"BROOKLYN DESERT","A Beautiful Drama of a Dentist And a Composer who must Battle a Sumo Wrestler in The First Manned Space Station",2006,English,7,4.99,R,161,21.99,Commentaries,Foreign,"41//JODIE//DEGENERES,62//JAYNE//NEESON,90//SEAN//GUINESS,125//ALBERT//NOLTE,172//GROUCHO//WILLIAMS"
101,"BROTHERHOOD BLANKET","A Fateful Character Study of a Butler And a Technical Writer who must Sink a Astronaut in Ancient Japan",2006,English,3,0.99,R,73,26.99,"Behind the Scenes",Documentary,"16//FRED//COSTNER,48//FRANCES//DAY-LEWIS,57//JUDE//CRUISE,62//JAYNE//NEESON,129//DARYL//CRAWFORD"
102,"BUBBLE GROSSE","A Awe-Inspiring Panorama of a Crocodile And a Moose who must Confront a Girl in A Baloon",2006,English,4,4.99,R,60,20.99,"Trailers,Commentaries,Deleted Scenes,Behind the Scenes",Sports,"158//VIVIEN//BASINGER,170//MENA//HOPPER,188//ROCK//DUKAKIS"
103,"BUCKET BROTHERHOOD","A Amazing Display of a Girl And a Womanizer who must Succumb a Lumberjack in A Baloon Factory",2006,English,7,4.99,PG,133,27.99,"Commentaries,Deleted Scenes",Travel,"26//RIP//CRAWFORD,32//TIM//HACKMAN,51//GARY//PHOENIX,89//CHARLIZE//DENCH,92//KIRSTEN//AKROYD,193//BURT//TEMPLE"
104,"BUGSY SONG","A Awe-Inspiring Character Study of a Secret Agent And a Boat who must Find a Squirrel in The First Manned Space Station",2006,English,4,2.99,G,119,17.99,Commentaries,Foreign,"82//WOODY//JOLIE,92//KIRSTEN//AKROYD"
105,"BULL SHAWSHANK","A Fanciful Drama of a Moose And a Squirrel who must Conquer a Pioneer in The Canadian Rockies",2006,English,6,0.99,NC-17,125,21.99,"Deleted Scenes",Action,"2//NICK//WAHLBERG,23//SANDRA//KILMER,29//ALEC//WAYNE,43//KIRK//JOVOVICH,116//DAN//STREEP,123//JULIANNE//DENCH,144//ANGELA//WITHERSPOON,150//JAYNE//NOLTE"
106,"BULWORTH COMMANDMENTS","A Amazing Display of a Mad Cow And a Pioneer who must Redeem a Sumo Wrestler in The Outback",2006,English,4,2.99,G,61,14.99,Trailers,Games,"1//PENELOPE//GUINESS,65//ANGELA//HUDSON,124//SCARLETT//BENING,173//ALAN//DREYFUSS"
107,"BUNCH MINDS","A Emotional Story of a Feminist And a Feminist who must Escape a Pastry Chef in A MySQL Convention",2006,English,4,2.99,G,63,13.99,"Behind the Scenes",Drama,"12//KARL//BERRY,28//WOODY//HOFFMAN,40//JOHNNY//CAGE,98//CHRIS//BRIDGES,130//GRETA//KEITEL,139//EWAN//GOODING,142//JADA//RYDER,167//LAURENCE//BULLOCK"
108,"BUTCH PANTHER","A Lacklusture Yarn of a Feminist And a Database Administrator who must Face a Hunter in New Orleans",2006,English,6,0.99,PG-13,67,19.99,"Trailers,Commentaries,Deleted Scenes",New,"15//CUBA//OLIVIER,52//CARMEN//HUNT,106//GROUCHO//DUNST"
109,"BUTTERFLY CHOCOLAT","A Fateful Story of a Girl And a Composer who must Conquer a Husband in A Shark Tank",2006,English,3,0.99,G,89,17.99,"Behind the Scenes",New,"44//NICK//STALLONE,53//MENA//TEMPLE,145//KIM//ALLEN,178//LISA//MONROE,179//ED//GUINESS,193//BURT//TEMPLE,198//MARY//KEITEL"
110,"CABIN FLASH","A Stunning Epistle of a Boat And a Man who must Challenge a A Shark in A Baloon Factory",2006,English,4,0.99,NC-17,53,25.99,"Commentaries,Deleted Scenes",Children,"13//UMA//WOOD,29//ALEC//WAYNE,83//BEN//WILLIS,187//RENEE//BALL"
111,"CADDYSHACK JEDI","A Awe-Inspiring Epistle of a Woman And a Madman who must Fight a Robot in Soviet Georgia",2006,English,3,0.99,NC-17,52,17.99,"Commentaries,Deleted Scenes",Action,"3//ED//CHASE,22//ELVIS//MARX,38//TOM//MCKELLEN,50//NATALIE//HOPKINS,69//KENNETH//PALTROW,154//MERYL//GIBSON,188//ROCK//DUKAKIS"
112,"CALENDAR GUNFIGHT","A Thrilling Drama of a Frisbee And a Lumberjack who must Sink a Man in Nigeria",2006,English,4,4.99,NC-17,120,22.99,"Trailers,Commentaries,Behind the Scenes",Foreign,"6//BETTE//NICHOLSON,24//CAMERON//STREEP,32//TIM//HACKMAN,33//MILLA//PECK,51//GARY//PHOENIX,107//GINA//DEGENERES,130//GRETA//KEITEL,140//WHOOPI//HURT"
113,"CALIFORNIA BIRDS","A Thrilling Yarn of a Database Administrator And a Robot who must Battle a Database Administrator in Ancient India",2006,English,4,4.99,NC-17,75,19.99,"Trailers,Commentaries,Deleted Scenes",Sports,"124//SCARLETT//BENING,183//RUSSELL//CLOSE"
114,"CAMELOT VACATION","A Touching Character Study of a Woman And a Waitress who must Battle a Pastry Chef in A MySQL Convention",2006,English,3,0.99,NC-17,61,26.99,"Trailers,Commentaries,Deleted Scenes,Behind the Scenes",Sci-Fi,"57//JUDE//CRUISE,125//ALBERT//NOLTE"
115,"CAMPUS REMEMBER","A Astounding Drama of a Crocodile And a Mad Cow who must Build a Robot in A Jet Boat",2006,English,5,2.99,R,167,27.99,"Behind the Scenes",Action,"8//MATTHEW//JOHANSSON,45//REESE//KILMER,168//WILL//WILSON"
116,"CANDIDATE PERDITION","A Brilliant Epistle of a Composer And a Database Administrator who must Vanquish a Mad Scientist in The First Manned Space Station",2006,English,4,2.99,R,70,10.99,"Deleted Scenes,Behind the Scenes",Classics,"23//SANDRA//KILMER,105//SIDNEY//CROWE,113//MORGAN//HOPKINS,200//THORA//TEMPLE"
117,"CANDLES GRAPES","A Fanciful Character Study of a Monkey And a Explorer who must Build a Astronaut in An Abandoned Fun House",2006,English,6,4.99,NC-17,135,15.99,"Trailers,Deleted Scenes",Games,"23//SANDRA//KILMER,45//REESE//KILMER,65//ANGELA//HUDSON,74//MILLA//KEITEL,89//CHARLIZE//DENCH,146//ALBERT//JOHANSSON,192//JOHN//SUVARI"
118,"CANYON STOCK","A Thoughtful Reflection of a Waitress And a Feminist who must Escape a Squirrel in A Manhattan Penthouse",2006,English,7,0.99,R,85,26.99,"Trailers,Deleted Scenes",Animation,"11//ZERO//CAGE,37//VAL//BOLGER,80//RALPH//CRUZ,100//SPENCER//DEPP,103//MATTHEW//LEIGH,149//RUSSELL//TEMPLE"
119,"CAPER MOTIONS","A Fateful Saga of a Moose And a Car who must Pursue a Woman in A MySQL Convention",2006,English,6,0.99,G,176,22.99,"Trailers,Commentaries,Deleted Scenes",Comedy,"17//HELEN//VOIGHT,34//AUDREY//OLIVIER,37//VAL//BOLGER,58//CHRISTIAN//AKROYD,127//KEVIN//GARLAND,128//CATE//MCQUEEN,193//BURT//TEMPLE"
120,"CARIBBEAN LIBERTY","A Fanciful Tale of a Pioneer And a Technical Writer who must Outgun a Pioneer in A Shark Tank",2006,English,3,4.99,NC-17,92,16.99,"Commentaries,Deleted Scenes",Sports,"83//BEN//WILLIS,93//ELLEN//PRESLEY,98//CHRIS//BRIDGES,110//SUSAN//DAVIS,131//JANE//JACKMAN,145//KIM//ALLEN,161//HARVEY//HOPE,167//LAURENCE//BULLOCK"
121,"CAROL TEXAS","A Astounding Character Study of a Composer And a Student who must Overcome a Composer in A Monastery",2006,English,4,2.99,PG,151,15.99,"Trailers,Behind the Scenes",Animation,"16//FRED//COSTNER,51//GARY//PHOENIX,59//DUSTIN//TAUTOU,83//BEN//WILLIS,158//VIVIEN//BASINGER,162//OPRAH//KILMER,200//THORA//TEMPLE"
122,"CARRIE BUNCH","A Amazing Epistle of a Student And a Astronaut who must Discover a Frisbee in The Canadian Rockies",2006,English,7,0.99,PG,114,11.99,"Trailers,Commentaries,Behind the Scenes",Horror,"37//VAL//BOLGER,53//MENA//TEMPLE,57//JUDE//CRUISE,76//ANGELINA//ASTAIRE,94//KENNETH//TORN,157//GRETA//MALDEN,196//BELA//WALKEN"
123,"CASABLANCA SUPER","A Amazing Panorama of a Crocodile And a Forensic Psychologist who must Pursue a Secret Agent in The First Manned Space Station",2006,English,6,4.99,G,85,22.99,"Trailers,Deleted Scenes,Behind the Scenes",Travel,"92//KIRSTEN//AKROYD,102//WALTER//TORN,144//ANGELA//WITHERSPOON,197//REESE//WEST"
124,"CASPER DRAGONFLY","A Intrepid Documentary of a Boat And a Crocodile who must Chase a Robot in The Sahara Desert",2006,English,3,4.99,PG-13,163,16.99,Trailers,Children,"17//HELEN//VOIGHT,64//RAY//JOHANSSON,80//RALPH//CRUZ,93//ELLEN//PRESLEY,102//WALTER//TORN"
125,"CASSIDY WYOMING","A Intrepid Drama of a Frisbee And a Hunter who must Kill a Secret Agent in New Orleans",2006,English,5,2.99,NC-17,61,19.99,"Commentaries,Behind the Scenes",Travel,"15//CUBA//OLIVIER,23//SANDRA//KILMER,34//AUDREY//OLIVIER,65//ANGELA//HUDSON,138//LUCILLE//DEE,144//ANGELA//WITHERSPOON,198//MARY//KEITEL"
126,"CASUALTIES ENCINO","A Insightful Yarn of a A Shark And a Pastry Chef who must Face a Boy in A Monastery",2006,English,3,4.99,G,179,16.99,Trailers,Action,"24//CAMERON//STREEP,53//MENA//TEMPLE,95//DARYL//WAHLBERG,106//GROUCHO//DUNST,110//SUSAN//DAVIS"
127,"CAT CONEHEADS","A Fast-Paced Panorama of a Girl And a A Shark who must Confront a Boy in Ancient India",2006,English,5,4.99,G,112,14.99,"Commentaries,Deleted Scenes",Comedy,"17//HELEN//VOIGHT,144//ANGELA//WITHERSPOON,159//LAURA//BRODY,187//RENEE//BALL"
128,"CATCH AMISTAD","A Boring Reflection of a Lumberjack And a Feminist who must Discover a Woman in Nigeria",2006,English,7,0.99,G,183,10.99,"Trailers,Behind the Scenes",Foreign,"40//JOHNNY//CAGE,58//CHRISTIAN//AKROYD,88//KENNETH//PESCI,116//DAN//STREEP,155//IAN//TANDY"
129,"CAUSE DATE","A Taut Tale of a Explorer And a Pastry Chef who must Conquer a Hunter in A MySQL Convention",2006,English,3,2.99,R,179,16.99,"Commentaries,Deleted Scenes,Behind the Scenes",Documentary,"54//PENELOPE//PINKETT,59//DUSTIN//TAUTOU,62//JAYNE//NEESON,175//WILLIAM//HACKMAN,195//JAYNE//SILVERSTONE,197//REESE//WEST"
130,"CELEBRITY HORN","A Amazing Documentary of a Secret Agent And a Astronaut who must Vanquish a Hunter in A Shark Tank",2006,English,7,0.99,PG-13,110,24.99,"Deleted Scenes,Behind the Scenes",Action,"59//DUSTIN//TAUTOU,103//MATTHEW//LEIGH,144//ANGELA//WITHERSPOON,195//JAYNE//SILVERSTONE"
131,"CENTER DINOSAUR","A Beautiful Character Study of a Sumo Wrestler And a Dentist who must Find a Dog in California",2006,English,5,4.99,PG,152,12.99,"Deleted Scenes",Classics,"29//ALEC//WAYNE,147//FAY//WINSLET,151//GEOFFREY//HESTON,179//ED//GUINESS"
132,"CHAINSAW UPTOWN","A Beautiful Documentary of a Boy And a Robot who must Discover a Squirrel in Australia",2006,English,6,0.99,PG,114,25.99,"Deleted Scenes,Behind the Scenes",Sci-Fi,"2//NICK//WAHLBERG,134//GENE//HOPKINS"
133,"CHAMBER ITALIAN","A Fateful Reflection of a Moose And a Husband who must Overcome a Monkey in Nigeria",2006,English,7,4.99,NC-17,117,14.99,Trailers,Music,"29//ALEC//WAYNE,60//HENRY//BERRY,68//RIP//WINSLET,107//GINA//DEGENERES,132//ADAM//HOPPER,133//RICHARD//PENN,148//EMILY//DEE"
134,"CHAMPION FLATLINERS","A Amazing Story of a Mad Cow And a Dog who must Kill a Husband in A Monastery",2006,English,4,4.99,PG,51,21.99,Trailers,Animation,"48//FRANCES//DAY-LEWIS,57//JUDE//CRUISE,63//CAMERON//WRAY,96//GENE//WILLIS"
135,"CHANCE RESURRECTION","A Astounding Story of a Forensic Psychologist And a Forensic Psychologist who must Overcome a Moose in Ancient China",2006,English,3,2.99,R,70,22.99,"Commentaries,Deleted Scenes,Behind the Scenes",Sports,"33//MILLA//PECK,58//CHRISTIAN//AKROYD,83//BEN//WILLIS,140//WHOOPI//HURT,144//ANGELA//WITHERSPOON,194//MERYL//ALLEN"
136,"CHAPLIN LICENSE","A Boring Drama of a Dog And a Forensic Psychologist who must Outrace a Explorer in Ancient India",2006,English,7,2.99,NC-17,146,26.99,"Behind the Scenes",New,"32//TIM//HACKMAN,104//PENELOPE//CRONYN,106//GROUCHO//DUNST,107//GINA//DEGENERES,118//CUBA//ALLEN,153//MINNIE//KILMER"
137,"CHARADE DUFFEL","A Action-Packed Display of a Man And a Waitress who must Build a Dog in A MySQL Convention",2006,English,3,2.99,PG,66,21.99,"Trailers,Deleted Scenes,Behind the Scenes",Sci-Fi,"86//GREG//CHAPLIN,92//KIRSTEN//AKROYD,108//WARREN//NOLTE"
138,"CHARIOTS CONSPIRACY","A Unbelieveable Epistle of a Robot And a Husband who must Chase a Robot in The First Manned Space Station",2006,English,5,2.99,R,71,29.99,"Deleted Scenes,Behind the Scenes",Sci-Fi,"107//GINA//DEGENERES,185//MICHAEL//BOLGER"
139,"CHASING FIGHT","A Astounding Saga of a Technical Writer And a Butler who must Battle a Butler in A Shark Tank",2006,English,7,4.99,PG,114,21.99,"Trailers,Commentaries",Family,"42//TOM//MIRANDA,142//JADA//RYDER,147//FAY//WINSLET,149//RUSSELL//TEMPLE,170//MENA//HOPPER"
140,"CHEAPER CLYDE","A Emotional Character Study of a Pioneer And a Girl who must Discover a Dog in Ancient Japan",2006,English,6,0.99,G,87,23.99,"Trailers,Commentaries,Behind the Scenes",Sci-Fi,"1//PENELOPE//GUINESS,20//LUCILLE//TRACY"
141,"CHICAGO NORTH","A Fateful Yarn of a Mad Cow And a Waitress who must Battle a Student in California",2006,English,6,4.99,PG-13,185,11.99,"Deleted Scenes,Behind the Scenes",Games,"79//MAE//HOFFMAN,118//CUBA//ALLEN,121//LIZA//BERGMAN,127//KEVIN//GARLAND,143//RIVER//DEAN,154//MERYL//GIBSON,193//BURT//TEMPLE,195//JAYNE//SILVERSTONE"
142,"CHICKEN HELLFIGHTERS","A Emotional Drama of a Dog And a Explorer who must Outrace a Technical Writer in Australia",2006,English,3,0.99,PG,122,24.99,"Trailers,Commentaries,Deleted Scenes,Behind the Scenes",Documentary,"21//KIRSTEN//PALTROW,60//HENRY//BERRY"
143,"CHILL LUCK","A Lacklusture Epistle of a Boat And a Technical Writer who must Fight a A Shark in The Canadian Rockies",2006,English,6,0.99,PG,142,17.99,"Trailers,Commentaries,Deleted Scenes",Drama,"66//MARY//TANDY,75//BURT//POSEY,82//WOODY//JOLIE,97//MEG//HAWKE,119//WARREN//JACKMAN"
144,"CHINATOWN GLADIATOR","A Brilliant Panorama of a Technical Writer And a Lumberjack who must Escape a Butler in Ancient India",2006,English,7,4.99,PG,61,24.99,"Trailers,Commentaries,Deleted Scenes",New,"13//UMA//WOOD,18//DAN//TORN,19//BOB//FAWCETT,57//JUDE//CRUISE,67//JESSICA//BAILEY,72//SEAN//WILLIAMS,120//PENELOPE//MONROE,151//GEOFFREY//HESTON,180//JEFF//SILVERSTONE,195//JAYNE//SILVERSTONE"
145,"CHISUM BEHAVIOR","A Epic Documentary of a Sumo Wrestler And a Butler who must Kill a Car in Ancient India",2006,English,5,4.99,G,124,25.99,"Trailers,Commentaries,Behind the Scenes",Family,"2//NICK//WAHLBERG,134//GENE//HOPKINS,147//FAY//WINSLET,199//JULIA//FAWCETT"
146,"CHITTY LOCK","A Boring Epistle of a Boat And a Database Administrator who must Kill a Sumo Wrestler in The First Manned Space Station",2006,English,6,2.99,G,107,24.99,Commentaries,Drama,"5//JOHNNY//LOLLOBRIGIDA,20//LUCILLE//TRACY,22//ELVIS//MARX,31//SISSY//SOBIESKI,37//VAL//BOLGER,101//SUSAN//DAVIS,149//RUSSELL//TEMPLE,165//AL//GARLAND,166//NICK//DEGENERES,171//OLYMPIA//PFEIFFER,178//LISA//MONROE,184//HUMPHREY//GARLAND,188//ROCK//DUKAKIS"
147,"CHOCOLAT HARRY","A Action-Packed Epistle of a Dentist And a Moose who must Meet a Mad Cow in Ancient Japan",2006,English,5,0.99,NC-17,101,16.99,"Commentaries,Behind the Scenes",Family,"9//JOE//SWANK,26//RIP//CRAWFORD,43//KIRK//JOVOVICH,131//JANE//JACKMAN,197//REESE//WEST"
148,"CHOCOLATE DUCK","A Unbelieveable Story of a Mad Scientist And a Technical Writer who must Discover a Composer in Ancient China",2006,English,3,2.99,R,132,13.99,"Trailers,Commentaries,Behind the Scenes",Foreign,"9//JOE//SWANK,24//CAMERON//STREEP,73//GARY//PENN,85//MINNIE//ZELLWEGER,123//JULIANNE//DENCH,164//HUMPHREY//WILLIS,172//GROUCHO//WILLIAMS"
149,"CHRISTMAS MOONSHINE","A Action-Packed Epistle of a Feminist And a Astronaut who must Conquer a Boat in A Manhattan Penthouse",2006,English,7,0.99,NC-17,150,21.99,"Trailers,Commentaries,Behind the Scenes",Children,"120//PENELOPE//MONROE,148//EMILY//DEE,200//THORA//TEMPLE"
150,"CIDER DESIRE","A Stunning Character Study of a Composer And a Mad Cow who must Succumb a Cat in Soviet Georgia",2006,English,7,2.99,PG,101,9.99,"Behind the Scenes",Documentary,"27//JULIA//MCQUEEN,41//JODIE//DEGENERES,48//FRANCES//DAY-LEWIS,54//PENELOPE//PINKETT,176//JON//CHASE"
151,"CINCINATTI WHISPERER","A Brilliant Saga of a Pastry Chef And a Hunter who must Confront a Butler in Berlin",2006,English,5,4.99,NC-17,143,26.99,"Deleted Scenes",Sci-Fi,"49//ANNE//CRONYN,112//RUSSELL//BACALL,118//CUBA//ALLEN,123//JULIANNE//DENCH"
152,"CIRCUS YOUTH","A Thoughtful Drama of a Pastry Chef And a Dentist who must Pursue a Girl in A Baloon",2006,English,5,2.99,PG-13,90,13.99,"Trailers,Deleted Scenes,Behind the Scenes",Children,"19//BOB//FAWCETT,181//MATTHEW//CARREY"
153,"CITIZEN SHREK","A Fanciful Character Study of a Technical Writer And a Husband who must Redeem a Robot in The Outback",2006,English,7,0.99,G,165,18.99,"Commentaries,Deleted Scenes",Sci-Fi,"25//KEVIN//BLOOM,51//GARY//PHOENIX,57//JUDE//CRUISE,77//CARY//MCCONAUGHEY,94//KENNETH//TORN,149//RUSSELL//TEMPLE,152//BEN//HARRIS,155//IAN//TANDY"
154,"CLASH FREDDY","A Amazing Yarn of a Composer And a Squirrel who must Escape a Astronaut in Australia",2006,English,6,2.99,G,81,12.99,"Commentaries,Deleted Scenes",Animation,"13//UMA//WOOD,14//VIVIEN//BERGEN,17//HELEN//VOIGHT,33//MILLA//PECK,121//LIZA//BERGMAN,145//KIM//ALLEN,173//ALAN//DREYFUSS"
155,"CLEOPATRA DEVIL","A Fanciful Documentary of a Crocodile And a Technical Writer who must Fight a A Shark in A Baloon",2006,English,6,0.99,PG-13,150,26.99,"Trailers,Deleted Scenes,Behind the Scenes",New,"12//KARL//BERRY,16//FRED//COSTNER,139//EWAN//GOODING,145//KIM//ALLEN,156//FAY//WOOD,175//WILLIAM//HACKMAN,192//JOHN//SUVARI"
156,"CLERKS ANGELS","A Thrilling Display of a Sumo Wrestler And a Girl who must Confront a Man in A Baloon",2006,English,3,4.99,G,164,15.99,Commentaries,Documentary,"104//PENELOPE//CRONYN,110//SUSAN//DAVIS,132//ADAM//HOPPER,196//BELA//WALKEN"
157,"CLOCKWORK PARADISE","A Insightful Documentary of a Technical Writer And a Feminist who must Challenge a Cat in A Baloon",2006,English,7,0.99,PG-13,143,29.99,"Trailers,Commentaries,Deleted Scenes,Behind the Scenes",Children,"87//SPENCER//PECK,109//SYLVESTER//DERN,122//SALMA//NOLTE,127//KEVIN//GARLAND,138//LUCILLE//DEE"
158,"CLONES PINOCCHIO","A Amazing Drama of a Car And a Robot who must Pursue a Dentist in New Orleans",2006,English,6,2.99,R,124,16.99,"Behind the Scenes",Music,"8//MATTHEW//JOHANSSON,65//ANGELA//HUDSON,105//SIDNEY//CROWE,122//SALMA//NOLTE,154//MERYL//GIBSON"
159,"CLOSER BANG","A Unbelieveable Panorama of a Frisbee And a Hunter who must Vanquish a Monkey in Ancient India",2006,English,5,4.99,R,58,12.99,"Trailers,Behind the Scenes",Comedy,"21//KIRSTEN//PALTROW,41//JODIE//DEGENERES,149//RUSSELL//TEMPLE,157//GRETA//MALDEN,179//ED//GUINESS,199//JULIA//FAWCETT"
160,"CLUB GRAFFITI","A Epic Tale of a Pioneer And a Hunter who must Escape a Girl in A U-Boat",2006,English,4,0.99,PG-13,65,12.99,"Trailers,Deleted Scenes",Animation,"38//TOM//MCKELLEN,137//MORGAN//WILLIAMS,178//LISA//MONROE,182//DEBBIE//AKROYD"
161,"CLUE GRAIL","A Taut Tale of a Butler And a Mad Scientist who must Build a Crocodile in Ancient China",2006,English,6,4.99,NC-17,70,27.99,"Trailers,Commentaries,Behind the Scenes",Music,"43//KIRK//JOVOVICH,68//RIP//WINSLET,87//SPENCER//PECK,121//LIZA//BERGMAN,134//GENE//HOPKINS,194//MERYL//ALLEN"
162,"CLUELESS BUCKET","A Taut Tale of a Car And a Pioneer who must Conquer a Sumo Wrestler in An Abandoned Fun House",2006,English,4,2.99,R,95,13.99,"Trailers,Deleted Scenes,Behind the Scenes",Action,"13//UMA//WOOD,89//CHARLIZE//DENCH,107//GINA//DEGENERES,111//CAMERON//ZELLWEGER,114//MORGAN//MCDORMAND,132//ADAM//HOPPER,173//ALAN//DREYFUSS,176//JON//CHASE"
163,"CLYDE THEORY","A Beautiful Yarn of a Astronaut And a Frisbee who must Overcome a Explorer in A Jet Boat",2006,English,4,0.99,PG-13,139,29.99,"Commentaries,Deleted Scenes,Behind the Scenes",New,"31//SISSY//SOBIESKI,40//JOHNNY//CAGE,86//GREG//CHAPLIN,194//MERYL//ALLEN"
164,"COAST RAINBOW","A Astounding Documentary of a Mad Cow And a Pioneer who must Challenge a Butler in The Sahara Desert",2006,English,4,0.99,PG,55,20.99,"Trailers,Commentaries,Deleted Scenes,Behind the Scenes",Documentary,"6//BETTE//NICHOLSON,24//CAMERON//STREEP,31//SISSY//SOBIESKI,45//REESE//KILMER,48//FRANCES//DAY-LEWIS,144//ANGELA//WITHERSPOON,162//OPRAH//KILMER,178//LISA//MONROE,193//BURT//TEMPLE,197//REESE//WEST"
165,"COLDBLOODED DARLING","A Brilliant Panorama of a Dentist And a Moose who must Find a Student in The Gulf of Mexico",2006,English,7,4.99,G,70,27.99,"Trailers,Deleted Scenes",Sci-Fi,"6//BETTE//NICHOLSON,20//LUCILLE//TRACY,83//BEN//WILLIS,107//GINA//DEGENERES"
166,"COLOR PHILADELPHIA","A Thoughtful Panorama of a Car And a Crocodile who must Sink a Monkey in The Sahara Desert",2006,English,6,2.99,G,149,19.99,"Commentaries,Behind the Scenes",Classics,"1//PENELOPE//GUINESS,106//GROUCHO//DUNST,122//SALMA//NOLTE,129//DARYL//CRAWFORD,163//CHRISTOPHER//WEST,171//OLYMPIA//PFEIFFER,192//JOHN//SUVARI"
167,"COMA HEAD","A Awe-Inspiring Drama of a Boy And a Frisbee who must Escape a Pastry Chef in California",2006,English,6,4.99,NC-17,109,10.99,Commentaries,Travel,"63//CAMERON//WRAY,117//RENEE//TRACY,151//GEOFFREY//HESTON"
168,"COMANCHEROS ENEMY","A Boring Saga of a Lumberjack And a Monkey who must Find a Monkey in The Gulf of Mexico",2006,English,5,0.99,R,67,23.99,"Trailers,Behind the Scenes",Children,"39//GOLDIE//BRODY,128//CATE//MCQUEEN,150//JAYNE//NOLTE,174//MICHAEL//BENING,187//RENEE//BALL"
169,"COMFORTS RUSH","A Unbelieveable Panorama of a Pioneer And a Husband who must Meet a Mad Cow in An Abandoned Mine Shaft",2006,English,3,2.99,NC-17,76,19.99,"Commentaries,Behind the Scenes",Travel,"149//RUSSELL//TEMPLE,154//MERYL//GIBSON,164//HUMPHREY//WILLIS,184//HUMPHREY//GARLAND,196//BELA//WALKEN"
170,"COMMAND DARLING","A Awe-Inspiring Tale of a Forensic Psychologist And a Woman who must Challenge a Database Administrator in Ancient Japan",2006,English,5,4.99,PG-13,120,28.99,"Behind the Scenes",Foreign,"7//GRACE//MOSTEL,75//BURT//POSEY,88//KENNETH//PESCI,121//LIZA//BERGMAN,135//RITA//REYNOLDS,139//EWAN//GOODING,151//GEOFFREY//HESTON,154//MERYL//GIBSON"
171,"COMMANDMENTS EXPRESS","A Fanciful Saga of a Student And a Mad Scientist who must Battle a Hunter in An Abandoned Mine Shaft",2006,English,6,4.99,R,59,13.99,"Trailers,Commentaries,Deleted Scenes",Horror,"5//JOHNNY//LOLLOBRIGIDA,36//BURT//DUKAKIS,119//WARREN//JACKMAN,189//CUBA//BIRCH"
172,"CONEHEADS SMOOCHY","A Touching Story of a Womanizer And a Composer who must Pursue a Husband in Nigeria",2006,English,7,4.99,NC-17,112,12.99,"Deleted Scenes,Behind the Scenes",Drama,"5//JOHNNY//LOLLOBRIGIDA,18//DAN//TORN,27//JULIA//MCQUEEN,29//ALEC//WAYNE,34//AUDREY//OLIVIER,47//JULIA//BARRYMORE,107//GINA//DEGENERES,119//WARREN//JACKMAN,133//RICHARD//PENN"
173,"CONFESSIONS MAGUIRE","A Insightful Story of a Car And a Boy who must Battle a Technical Writer in A Baloon",2006,English,7,4.99,PG-13,65,25.99,"Behind the Scenes",Drama,"7//GRACE//MOSTEL,112//RUSSELL//BACALL,119//WARREN//JACKMAN,190//AUDREY//BAILEY"
174,"CONFIDENTIAL INTERVIEW","A Stunning Reflection of a Cat And a Woman who must Find a Astronaut in Ancient Japan",2006,English,6,4.99,NC-17,180,13.99,Commentaries,Music,"46//PARKER//GOLDBERG,109//SYLVESTER//DERN"
